Name,Event,Description,Cost,Date,Time,Address,Ticket_URL
High Line Comedy Club,Comedy Show,"An evening stand-up show featuring touring and televison comedians, held inside the High Line Comedy Club with on-site mini-golf available. Doors typically open before the performance for food and drinks.",N/A,2026-03-27,7:00 PM,"446 W 14th St, New York, NY 10014, USA",https://www.eventbrite.com/e/comedy-show-mini-golf-ticket-tickets-1633019508309
High Line Comedy Club,Comedy Show and Complimentary Mini-Golf,A stand-up comedy performance that includes complimentary access to on-site mini-golf (Puttery) before or after the show. Food and drinks are available during the event.,N/A,2026-03-28,7:00 PM,"446 W 14th St, New York, NY 10014, USA",https://www.eventbrite.com/e/comedy-show-mini-golf-ticket-tickets-1633019508309
High Line Comedy Club,Comedy Show and Complimentary Mini-Golf,A featured stand-up comedy show with a mix of touring and TV comedians; includes complimentary mini-golf at the venue. Recommended to arrive early for seating and mini-golf.,N/A,2026-04-03,7:00 PM,"446 W 14th St, New York, NY 10014, USA",https://www.eventbrite.com/e/comedy-show-mini-golf-ticket-tickets-1633019508309
High Line Comedy Club,Comedy Show and Complimentary Mini-Golf,Weekend stand-up show with comedians from TV and streaming; guests can play complimentary mini-golf on-site before or after the show. Food and full bar service available.,N/A,2026-04-04,7:00 PM,"446 W 14th St, New York, NY 10014, USA",https://www.eventbrite.com/e/comedy-show-mini-golf-ticket-tickets-1633019508309
Rodney's Comedy Club,"ZAR THE STAR, JILBERTO SOTO, SEAN DONNELLY, ALLY LEFTRIDGE AND MORE","Step into the spotlight at Rodney’s Comedy Club for a night of stand-up featuring top comedians, rising stars, and surprise guests. Enjoy great drinks and classic New York comedy at this iconic venue.",$20+,2026-03-27,8:30 PM,"1118 1st Ave, New York, NY 10065, USA",https://parde.app/attending/events/e6ddf9e8-bc89-4017-b44e-9342e9b18df1
Rodney's Comedy Club,"CHUCK NICE, DEREK HUMPHREY, OLGA NAMER, TALIA REESE, DANIEL PERAFAN AND MORE",A stacked Saturday night showcase at Rodney’s featuring established and up-and-coming comedians performing live stand-up. Expect a lively lineup and classic club atmosphere.,$25+,2026-03-28,8:30 PM,"1118 1st Ave, New York, NY 10065, USA",https://parde.app/attending/events/41696680-7652-48cc-b744-a9e5c4d9d645
Rodney's Comedy Club,THE HAMBURGER CLUB,The Hamburger Club Live! — a comedy game show where comedians are randomly selected to compete in a jeopardy-style game; winners advance for a cash prize. Adult themes possible; $5 upcharge at the door.,$20+,2026-03-29,8:00 PM,"1118 1st Ave, New York, NY 10065, USA",https://parde.app/attending/events/b495d398-1ed2-46c9-85b0-c7fa1ef87b69
Rodney's Comedy Club,Sketches from the Edge of Flamenco,"A bold, multi-sensory theatrical work blending flamenco, film, and surreal humor by Omonike Akinyemi. A theatrical performance with dance and narrative elements presented at Rodney’s.",$35.00,2026-03-31,7:00 PM,"1118 1st Ave, New York, NY 10065, USA",https://parde.app/attending/events/5179374b-1380-410d-80d1-4b4be4373830
Rodney's Comedy Club,MAX MEISEL AND FRIENDS,Max Meisel (feature for Tom Arnold) performs his one-hour special with supporting comedians in a night of stand-up. A showcase of Meisel's hour-long set and guest features.,$25+,2026-04-01,7:30 PM,"1118 1st Ave, New York, NY 10065, USA",https://parde.app/attending/events/737de51b-26bf-4e0b-8541-b0048ff0d6a4
Rodney's Comedy Club,Thursday Night Live,Thursday Night Live at Rodney’s — an evening showcase of stand-up featuring a rotating lineup of comedians and surprise guests. Classic NYC comedy in an intimate showroom.,$15.00,2026-04-02,7:30 PM,"1118 1st Ave, New York, NY 10065, USA",https://parde.app/attending/events/15ccd0a4-b683-4bac-9cee-7f2d10945007
Rodney's Comedy Club,Friday Night Laughs at Rodney's,Friday Night Laughs — a lively Friday showcase with top local comedians and headliners delivering sets in a historic NYC comedy room. Enjoy an evening of curated stand-up.,$20,2026-04-03,8:30 PM,"1118 1st Ave, New York, NY 10065, USA",https://parde.app/attending/events/efb8aa83-943b-4586-8e0b-55c0442e60ca
Rodney's Comedy Club,Saturday Night Laughs,Saturday Night Laughs — a weekend headliner showcase featuring stand-up sets from top and emerging comedians in a classic comedy-club setting.,$20,2026-04-04,8:30 PM,"1118 1st Ave, New York, NY 10065, USA",https://parde.app/attending/events/16a75fcc-bd1a-4679-b20c-81af02aaede8
Rodney's Comedy Club,GENO AND FRIENDS,Geno and Friends — an evening of stand-up featuring Geno and guest comedians. A relaxed Sunday showcase with a mix of local talent.,$20,2026-04-05,7:30 PM,"1118 1st Ave, New York, NY 10065, USA",https://parde.app/attending/events/76570193-a398-4357-955d-21c5dcb6217e
Comedy Village,NYC Stand-Up,"A late-night showcase of NYC stand-up comedians featuring club veterans and surprise drop-ins, delivering an edgier, no-holds-barred set in an intimate Times Square room.",$25.00,2026-03-26,7:00 PM,"352 W 44th St, Manhattan, NY 10036, USA",https://comedyvillage.com/event/
Comedy Village,Times Square Comedy,"A 9 PM late show featuring a curated lineup of NYC comedians from the local circuit and streaming/TV, offering a high-energy late-night stand-up experience in Times Square.",$25.00,2026-03-26,9:00 PM,"352 W 44th St, Manhattan, NY 10036, USA",https://comedyvillage.com/event/
Comedy Village,NYC Stand-Up,"An 8 PM showcase of working NYC comedians delivering tight, punchy sets in an intimate club setting — great for an evening of live stand-up.",$28.00,2026-03-27,8:00 PM,"352 W 44th St, Manhattan, NY 10036, USA",https://comedyvillage.com/event/
Comedy Village,Times Square Comedy,A late 10 PM show with a roster of NYC comics and touring performers delivering high-energy late-night comedy in Times Square.,$28.00,2026-03-27,10:00 PM,"352 W 44th St, Manhattan, NY 10036, USA",https://comedyvillage.com/event/
Comedy Village,NYC Stand-Up,A late-night set featuring club regulars and surprise drop-ins for an authentic New York comedy experience.,$28.00,2026-03-27,11:00 PM,"352 W 44th St, Manhattan, NY 10036, USA",https://comedyvillage.com/event/
Comedy Village,NYC Stand-Up,"An 8 PM weekend showcase of NYC comedians offering a lively, club-style stand-up experience in an intimate Times Square venue.",$28.00,2026-03-28,8:00 PM,"352 W 44th St, Manhattan, NY 10036, USA",https://comedyvillage.com/event/
Comedy Village,Times Square Comedy,A 10 PM late show featuring seasoned NYC comics and touring performers delivering big-room laughs in Times Square.,$28.00,2026-03-28,10:00 PM,"352 W 44th St, Manhattan, NY 10036, USA",https://comedyvillage.com/event/
Comedy Village,NYC Stand-Up,A late-night set with club veterans and emerging comedians delivering high-energy material for a night-owl crowd.,$28.00,2026-03-28,11:00 PM,"352 W 44th St, Manhattan, NY 10036, USA",https://comedyvillage.com/event/
Comedy Village,NYC Stand-Up,"A 7 PM Sunday showcase of NYC comics offering an early-evening, authentic stand-up experience in Times Square.",$22.00,2026-03-29,7:00 PM,"352 W 44th St, Manhattan, NY 10036, USA",https://comedyvillage.com/event/
Comedy Village,Times Square Comedy,"A 9 PM Sunday late show featuring a lineup of NYC comedians performing sharp, crowd-pleasing sets.",$22.00,2026-03-29,9:00 PM,"352 W 44th St, Manhattan, NY 10036, USA",https://comedyvillage.com/event/
Comedy Village,NYC Stand-Up,"A Monday 7 PM showcase of NYC stand-ups delivering tight, punchy sets in a cozy Times Square club.",$22.00,2026-03-30,7:00 PM,"352 W 44th St, Manhattan, NY 10036, USA",https://comedyvillage.com/event/
Comedy Village,Times Square Comedy,A 9 PM Monday late show with a rotating lineup of NYC comics and touring performers for a lively weeknight outing.,$22.00,2026-03-30,9:00 PM,"352 W 44th St, Manhattan, NY 10036, USA",https://comedyvillage.com/event/
Comedy Village,NYC Stand-Up,A Tuesday 7 PM showcase of New York comics delivering a club-style set of stand-up in an intimate venue.,$22.00,2026-03-31,7:00 PM,"352 W 44th St, Manhattan, NY 10036, USA",https://comedyvillage.com/event/
Comedy Village,NYC Stand-Up,A Tuesday 9 PM late show featuring a lineup of seasoned and up-and-coming NYC comedians.,$22.00,2026-03-31,9:00 PM,"352 W 44th St, Manhattan, NY 10036, USA",https://comedyvillage.com/event/
Comedy Village,Times Square Comedy,A Wednesday 7 PM midweek showcase with curated stand-up lineups from local and touring comedians.,$25.00,2026-04-01,7:00 PM,"352 W 44th St, Manhattan, NY 10036, USA",https://comedyvillage.com/event/
Comedy Village,NYC Stand-Up,A Wednesday 9 PM showcase mixing club veterans and breakout comics for a lively late-night set.,$25.00,2026-04-01,9:00 PM,"352 W 44th St, Manhattan, NY 10036, USA",https://comedyvillage.com/event/
Comedy Village,NYC Stand-Up,"A Thursday 7 PM showcase of NYC stand-ups offering a tight, punchy early-evening comedy experience.",$25.00,2026-04-02,7:00 PM,"352 W 44th St, Manhattan, NY 10036, USA",https://comedyvillage.com/event/
Comedy Village,Times Square Comedy,A Thursday 9 PM late show featuring a rotating lineup of NYC comics and touring performers for a high-energy night.,$25.00,2026-04-02,9:00 PM,"352 W 44th St, Manhattan, NY 10036, USA",https://comedyvillage.com/event/
Comedy Village,NYC Stand-Up,A Friday 8 PM showcase presenting a lineup of NYC comics delivering headline-style sets for a weekend crowd.,$28.00,2026-04-03,8:00 PM,"352 W 44th St, Manhattan, NY 10036, USA",https://comedyvillage.com/event/
Comedy Village,Times Square Comedy,A Friday 10 PM late show featuring seasoned comedians and lively late-night performances in Times Square.,$28.00,2026-04-03,10:00 PM,"352 W 44th St, Manhattan, NY 10036, USA",https://comedyvillage.com/event/
Comedy Village,NYC Stand-Up,A late 11 PM Friday set showcasing club regulars and surprise drop-ins for a true NYC late-night comedy vibe.,$28.00,2026-04-03,11:00 PM,"352 W 44th St, Manhattan, NY 10036, USA",https://comedyvillage.com/event/
Comedy Village,NYC Stand-Up,A Saturday 8 PM weekend showcase with a lineup of New York comics performing in an intimate Times Square venue.,$28.00,2026-04-04,8:00 PM,"352 W 44th St, Manhattan, NY 10036, USA",https://comedyvillage.com/event/
Comedy Village,Times Square Comedy,A Saturday 10 PM late show featuring touring and local comedians delivering high-energy late-night sets.,$28.00,2026-04-04,10:00 PM,"352 W 44th St, Manhattan, NY 10036, USA",https://comedyvillage.com/event/
Comedy Village,NYC Stand-Up,A late 11 PM Saturday show with club veterans and breakout acts for a true NYC night-out experience.,$28.00,2026-04-04,11:00 PM,"352 W 44th St, Manhattan, NY 10036, USA",https://comedyvillage.com/event/
Comedy Village,NYC Stand-Up,A Sunday 7 PM showcase featuring a curated lineup of NYC comedians offering an early-evening comedy option.,$22.00,2026-04-05,7:00 PM,"352 W 44th St, Manhattan, NY 10036, USA",https://comedyvillage.com/event/
Comedy Village,Times Square Comedy,"A Sunday 9 PM late show with a rotating roster of NYC comics delivering sharp, crowd-pleasing sets.",$22.00,2026-04-05,9:00 PM,"352 W 44th St, Manhattan, NY 10036, USA",https://comedyvillage.com/event/
Comedy Village,NYC Stand-Up,A Monday 7 PM showcase of NYC stand-ups offering a midweek night of live comedy in Times Square.,$22.00,2026-04-06,7:00 PM,"352 W 44th St, Manhattan, NY 10036, USA",https://comedyvillage.com/event/
Comedy Village,Times Square Comedy,A Monday 9 PM late show featuring local and touring comics for a lively weeknight option in Midtown.,$22.00,2026-04-06,9:00 PM,"352 W 44th St, Manhattan, NY 10036, USA",https://comedyvillage.com/event/
Comedy Village,NYC Stand-Up,"A Tuesday 7 PM showcase with New York stand-ups performing tight, punchy sets in an intimate club setting.",$22.00,2026-04-07,7:00 PM,"352 W 44th St, Manhattan, NY 10036, USA",https://comedyvillage.com/event/
Comedy Village,NYC Stand-Up,A Tuesday 9 PM late show mixing club veterans and breakout comics for a high-energy set in Times Square.,$22.00,2026-04-07,9:00 PM,"352 W 44th St, Manhattan, NY 10036, USA",https://comedyvillage.com/event/
Comedy Village,Times Square Comedy,A Wednesday 7 PM midweek showcase featuring curated stand-up lineups from local and touring comedians.,$25.00,2026-04-08,7:00 PM,"352 W 44th St, Manhattan, NY 10036, USA",https://comedyvillage.com/event/
Comedy Village,NYC Stand-Up,A Wednesday 9 PM late show that brings together seasoned and emerging NYC comics for a punchline-heavy evening.,$25.00,2026-04-08,9:00 PM,"352 W 44th St, Manhattan, NY 10036, USA",https://comedyvillage.com/event/
Comedy In Harlem,K. Smith & Friends Comedy Show,"Hosted by K. Smith with a stacked lineup including Marcy Smiles, Mark Gregory, Chris Grant, Lena E., and Darien Tang for an evening of stand-up and New York comedy energy.",$30,2026-03-26,8:00 PM,"750A St Nicholas Ave, New York, NY 10031, USA",https://www.comedyinharlem.com/events
Comedy In Harlem,Kareem Green: Cut The Malarkey,"Headlined by Kareem Green with support from Shatara Curry and Stephon Hightower; a night of sharp, storytelling stand-up.",$25,2026-03-27,8:00 PM,"750A St Nicholas Ave, New York, NY 10031, USA",https://www.comedyinharlem.com/events
Comedy In Harlem,Ladies Night Comedy Show hosted by Nicky Sunshine,"A grown-folks Saturday night comedy show hosted by Nicky Sunshine featuring Cookie Hull, Joanna Briley, Sashalyn Medina, Mugga and more.",$25,2026-03-28,8:00 PM,"750A St Nicholas Ave, New York, NY 10031, USA",https://www.comedyinharlem.com/events
Comedy In Harlem,Sugar Shack Sundays Hosted by Rob Stapleton,"Weekly Sunday night high-energy comedy hosted by Rob Stapleton with music by DJ Mike Neezy, blending stand-up and party vibes.",$20,2026-03-29,7:00 PM,"750A St Nicholas Ave, New York, NY 10031, USA",https://www.comedyinharlem.com/events
Comedy In Harlem,FUNNY LINES OPEN MIC,"Weekly open mic hosted by Sashalyn Medina where comics get 5-7 minutes; supportive, intimate NYC crowd and a proving ground for new material.",$5,2026-03-30,5:30 PM,"750A St Nicholas Ave, New York, NY 10031, USA",https://www.comedyinharlem.com/events
Comedy In Harlem,R&B Karaoke and Comedy hosted by Monifah,An R&B karaoke and comedy night hosted by Monifah and Jamie Roberts with DJ K Swift — karaoke meets stand-up for a lively Monday vibe.,N/A,2026-03-30,8:00 PM,"750A St Nicholas Ave, New York, NY 10031, USA",https://www.comedyinharlem.com/events
Comedy In Harlem,TEASE ME TUESDAYS - Poetry Night & Comedy,"A blend of poetry and comedy with DJs and hosts Brother Earl & Rashad Bashir — a grown, sexy late-night lounge vibe featuring spoken word and stand-up.",$20 online | $25 at the door,2026-03-31,8:00 PM,"750A St Nicholas Ave, New York, NY 10031, USA",https://www.comedyinharlem.com/events
Comedy In Harlem,April Fools Laughs at Comedy In Harlem,"A stacked April Fools comedy lineup headlined by Omar Gooding with Mike Ross, Mark Gregory and hosted by Simeon Goodson for a night of high-energy stand-up.",Tickets start at $25,2026-04-01,8:00 PM,"750A St Nicholas Ave, New York, NY 10031, USA",https://www.comedyinharlem.com/events
Drunk Shakespeare,Drunk Romeo & Juliet,"An immersive comedy show where five actors perform a Shakespeare play while one takes five shots of whiskey, creating unpredictable hilarity as the sober cast tries to keep the production on track.",Tickets from $75,2026-03-27,8:00 PM,"35 W 39th St, New York, NY 10018, USA",https://tickets.drunkshakespeare.com/events/RJNYC/2026-03-27-2000
Drunk Shakespeare,Drunk Romeo & Juliet,"An immersive comedy show where five actors perform a Shakespeare play while one takes five shots of whiskey, creating unpredictable hilarity as the sober cast tries to keep the production on track.",Tickets from $39,2026-03-27,10:00 PM,"35 W 39th St, New York, NY 10018, USA",https://tickets.drunkshakespeare.com/events/RJNYC/2026-03-27-2200
Drunk Shakespeare,Drunk Romeo & Juliet,"An immersive comedy show where five actors perform a Shakespeare play while one takes five shots of whiskey, creating unpredictable hilarity as the sober cast tries to keep the production on track.",Tickets from $55,2026-03-28,5:00 PM,"35 W 39th St, New York, NY 10018, USA",https://tickets.drunkshakespeare.com/events/RJNYC/2026-03-28-1700
Drunk Shakespeare,Drunk Romeo & Juliet,"An immersive comedy show where five actors perform a Shakespeare play while one takes five shots of whiskey, creating unpredictable hilarity as the sober cast tries to keep the production on track.",Tickets from $55,2026-03-28,7:00 PM,"35 W 39th St, New York, NY 10018, USA",https://tickets.drunkshakespeare.com/events/RJNYC/2026-03-28-1900
Drunk Shakespeare,Drunk Romeo & Juliet,"An immersive comedy show where five actors perform a Shakespeare play while one takes five shots of whiskey, creating unpredictable hilarity as the sober cast tries to keep the production on track.",Tickets from $55,2026-03-28,9:00 PM,"35 W 39th St, New York, NY 10018, USA",https://tickets.drunkshakespeare.com/events/RJNYC/2026-03-28-2100
Drunk Shakespeare,Drunk Romeo & Juliet,"An immersive comedy show where five actors perform a Shakespeare play while one takes five shots of whiskey, creating unpredictable hilarity as the sober cast tries to keep the production on track.",Tickets from $39,2026-03-29,5:00 PM,"35 W 39th St, New York, NY 10018, USA",https://tickets.drunkshakespeare.com/events/RJNYC/2026-03-29-1700
Drunk Shakespeare,Drunk Romeo & Juliet,"An immersive comedy show where five actors perform a Shakespeare play while one takes five shots of whiskey, creating unpredictable hilarity as the sober cast tries to keep the production on track.",Tickets from $55,2026-03-30,7:00 PM,"35 W 39th St, New York, NY 10018, USA",https://tickets.drunkshakespeare.com/events/RJNYC/2026-03-30-1900
Drunk Shakespeare,Drunk Romeo & Juliet,"An immersive comedy show where five actors perform a Shakespeare play while one takes five shots of whiskey, creating unpredictable hilarity as the sober cast tries to keep the production on track.",Tickets from $55,2026-03-31,7:00 PM,"35 W 39th St, New York, NY 10018, USA",https://tickets.drunkshakespeare.com/events/RJNYC/2026-03-31-1900
Drunk Shakespeare,Drunk Romeo & Juliet,"An immersive comedy show where five actors perform a Shakespeare play while one takes five shots of whiskey, creating unpredictable hilarity as the sober cast tries to keep the production on track.",Tickets from $55,2026-04-01,7:00 PM,"35 W 39th St, New York, NY 10018, USA",https://tickets.drunkshakespeare.com/events/RJNYC/2026-04-01-1900
Drunk Shakespeare,Drunk Romeo & Juliet,"An immersive comedy show where five actors perform a Shakespeare play while one takes five shots of whiskey, creating unpredictable hilarity as the sober cast tries to keep the production on track.",Tickets from $69,2026-04-02,7:00 PM,"35 W 39th St, New York, NY 10018, USA",https://tickets.drunkshakespeare.com/events/RJNYC/2026-04-02-1900
Drunk Shakespeare,Drunk Romeo & Juliet,"An immersive comedy show where five actors perform a Shakespeare play while one takes five shots of whiskey, creating unpredictable hilarity as the sober cast tries to keep the production on track.",Tickets from $69,2026-04-03,8:00 PM,"35 W 39th St, New York, NY 10018, USA",https://tickets.drunkshakespeare.com/events/RJNYC/2026-04-03-2000
Drunk Shakespeare,Drunk Romeo & Juliet,"An immersive comedy show where five actors perform a Shakespeare play while one takes five shots of whiskey, creating unpredictable hilarity as the sober cast tries to keep the production on track.",Tickets from $69,2026-04-03,10:00 PM,"35 W 39th St, New York, NY 10018, USA",https://tickets.drunkshakespeare.com/events/RJNYC/2026-04-03-2200
Drunk Shakespeare,Drunk Romeo & Juliet,"An immersive comedy show where five actors perform a Shakespeare play while one takes five shots of whiskey, creating unpredictable hilarity as the sober cast tries to keep the production on track.",Tickets from $69,2026-04-04,5:00 PM,"35 W 39th St, New York, NY 10018, USA",https://tickets.drunkshakespeare.com/events/RJNYC/2026-04-04-1700
Drunk Shakespeare,Drunk Romeo & Juliet,"An immersive comedy show where five actors perform a Shakespeare play while one takes five shots of whiskey, creating unpredictable hilarity as the sober cast tries to keep the production on track.",Tickets from $69,2026-04-04,7:00 PM,"35 W 39th St, New York, NY 10018, USA",https://tickets.drunkshakespeare.com/events/RJNYC/2026-04-04-1900
Drunk Shakespeare,Drunk Romeo & Juliet,"An immersive comedy show where five actors perform a Shakespeare play while one takes five shots of whiskey, creating unpredictable hilarity as the sober cast tries to keep the production on track.",Tickets from $69,2026-04-04,9:00 PM,"35 W 39th St, New York, NY 10018, USA",https://tickets.drunkshakespeare.com/events/RJNYC/2026-04-04-2100
Drunk Shakespeare,Drunk Romeo & Juliet,"An immersive comedy show where five actors perform a Shakespeare play while one takes five shots of whiskey, creating unpredictable hilarity as the sober cast tries to keep the production on track.",Tickets from $69,2026-04-05,5:00 PM,"35 W 39th St, New York, NY 10018, USA",https://tickets.drunkshakespeare.com/events/RJNYC/2026-04-05-1700
Drunk Shakespeare,Drunk Romeo & Juliet,"An immersive comedy show where five actors perform a Shakespeare play while one takes five shots of whiskey, creating unpredictable hilarity as the sober cast tries to keep the production on track.",Tickets from $69,2026-04-06,7:00 PM,"35 W 39th St, New York, NY 10018, USA",https://tickets.drunkshakespeare.com/events/RJNYC/2026-04-06-1900
Drunk Shakespeare,Drunk Romeo & Juliet,"An immersive comedy show where five actors perform a Shakespeare play while one takes five shots of whiskey, creating unpredictable hilarity as the sober cast tries to keep the production on track.",Tickets from $69,2026-04-07,7:00 PM,"35 W 39th St, New York, NY 10018, USA",https://tickets.drunkshakespeare.com/events/RJNYC/2026-04-07-1900
Drunk Shakespeare,Drunk Romeo & Juliet,"An immersive comedy show where five actors perform a Shakespeare play while one takes five shots of whiskey, creating unpredictable hilarity as the sober cast tries to keep the production on track.",Tickets from $69,2026-04-08,7:00 PM,"35 W 39th St, New York, NY 10018, USA",https://tickets.drunkshakespeare.com/events/RJNYC/2026-04-08-1900
Drunk Shakespeare,Drunk Romeo & Juliet,"An immersive comedy show where five actors perform a Shakespeare play while one takes five shots of whiskey, creating unpredictable hilarity as the sober cast tries to keep the production on track.",Tickets from $69,2026-04-09,7:00 PM,"35 W 39th St, New York, NY 10018, USA",https://tickets.drunkshakespeare.com/events/RJNYC/2026-04-09-1900
Caveat,Life In a Blender + Elgin Marbles,A live music show featuring performances by Life In a Blender and Elgin Marbles at Caveat. Expect a short set from each band in an intimate Lower East Side venue.,$18.76,2026-03-27,6:00 PM,"21 A Clinton St, New York, NY 10002, USA",https://www.eventbrite.com/e/life-in-a-blender-elgin-marbles-tickets-1983269727142
Caveat,NYC Magic Ensemble,A night of world-class magicians and mentalists performing a variety of close-up and stage magic. The show features multiple performers in a fast-paced variety format.,$24.41+,2026-03-27,9:30 PM,"21 A Clinton St, New York, NY 10002, USA",https://www.eventbrite.com/e/nyc-magic-ensemble-tickets-1981016142610
Caveat,Nerd Nite,"An evening of entertaining, fun-yet-informative talks where presenters give short, quirky lectures across science, history, and culture while the audience drinks along. Each show features multiple presenters and lighthearted Q&A.",$25.54+,2026-03-28,7:00 PM,"21 A Clinton St, New York, NY 10002, USA",https://www.eventbrite.com/e/nerd-nite-tickets-1980492235590
Caveat,Most Of My Moms are Gay,"A one-woman musical comedy by Abby Goldfarb about identity, family, and growing up the daughter of five mothers. The show blends music and storytelling in a personal, comedic performance.",$24.41,2026-03-31,7:00 PM,"21 A Clinton St, New York, NY 10002, USA",https://www.eventbrite.com/e/most-of-my-moms-are-gay-tickets-1977648494885
Caveat,Trans Voices Cabaret,"A cabaret showcasing transgender and nonbinary performers delivering music, comedy, and theatrical numbers. The show highlights trans and nonbinary talent from NYC’s theater and cabaret communities.",$24.41+,2026-04-05,5:00 PM,"21 A Clinton St, New York, NY 10002, USA",https://www.eventbrite.com/e/trans-voices-cabaret-tickets-1982825359025
Caveat,Immigrant Jam,"A comedy night celebrating immigrant and first-generation performers, hosted by Lucie Pohl; features stand-up, storytelling, and sketch about cross-cultural experiences. Lineups rotate monthly.",$24.41+,2026-04-03,7:00 PM,"21 A Clinton St, New York, NY 10002, USA",https://caveat.nyc/events
Caveat,Drunk Bollywood Trivia,"A Bollywood-themed trivia night with rounds on movies, music, dance, and celebrities, intercut with performances and prizes. A lighthearted, audience-interactive trivia experience.",$18.76,2026-04-06,7:00 PM,"21 A Clinton St, New York, NY 10002, USA",https://caveat.nyc/events
Caveat,Unpacking the Punchline,"A comedy show where a stand-up set is followed by a licensed therapist joining to unpack the comedian’s material live with the audience. Part comedy, part live discussion about the themes behind the jokes.",$24.41,2026-04-07,9:30 PM,"21 A Clinton St, New York, NY 10002, USA",https://www.eventbrite.com/e/unpacking-the-punchline-tickets-1983397567516
Comedy Cellar,Rotating Lineup (Regular Show),Regular stand-up show at the Comedy Cellar featuring a rotating lineup of comedians. Two-item minimum (food or drink) applies and individual lineups are subject to change.,$18.00,2026-03-26,6:45 PM,"117 MacDougal St, New York, NY 10012, USA",https://www.comedycellar.com/reservations-newyork/
