Name,Event,Description,Cost,Date,Time,Address,Ticket_URL
The Stand,"The Stand Presents: Emil Wakim, Jamie Wolf, Rayna Greenberg, & More!","Upstairs showcase featuring Emil Wakim, Jamie Wolf and Rayna Greenberg. A multi-comic comedy event.",$25.00,2026-04-06,7:00 PM,"116 E 16th St, New York, NY 10003, USA",https://thestandnyc.com/shows/
The Stand,The Legion Of Skanks Podcast Live,"Live performance of the Legion Of Skanks podcast featuring Big Jay Oakerson, Luis J. Gomez and special guests. A podcast/live comedy hybrid event.",$25.00,2026-04-06,8:00 PM,"116 E 16th St, New York, NY 10003, USA",https://thestandnyc.com/shows/
The Stand,FRANTIC! FREE SHOW,Free upstairs comedy showcase with a rotating roster of comics. Free admission (reserve or arrive early as seating is limited).,FREE!,2026-04-06,9:00 PM,"116 E 16th St, New York, NY 10003, USA",https://thestandnyc.com/shows/
The Stand,"The Stand Presents: Matthew Broussard, Jourdain Fisher, Mark Normand, & More!","Main-room headliner show featuring Matthew Broussard, Jourdain Fisher and Mark Normand. A curated main-room comedy lineup.",$30.00,2026-04-07,8:00 PM,"116 E 16th St, New York, NY 10003, USA",https://thestandnyc.com/shows/
The Stand,"The Stand Presents: Judah Friedlander, Jamie Wolf, Leonard Ouzts, & More!","Upstairs show featuring Judah Friedlander, Jamie Wolf and Leonard Ouzts. A mixed-bill upstairs comedy event.",$30.00,2026-04-07,9:00 PM,"116 E 16th St, New York, NY 10003, USA",https://thestandnyc.com/shows/
The Stand,Love F*cks: A Comedy Dating Show,A themed comedy/dating show featuring comedians and audience interaction; a comedic dating show concept in the main room. Presented as a ticketed event.,$25.00,2026-04-07,10:00 PM,"116 E 16th St, New York, NY 10003, USA",https://www.tixr.com/groups/thestandnyc/events/love-f-cks-a-comedy-dating-show-182760
The Stand,Culture Wars Presented by Marito Lopez,"Upstairs showcase presented by Marito Lopez featuring Mark Normand, Harshil Shukla and others. A themed multi-comic event.",$20.00,2026-04-08,8:00 PM,"116 E 16th St, New York, NY 10003, USA",https://thestandnyc.com/shows/
The Stand,"The Stand Presents: Jamie Wolf, Emil Wakim, Matthew Broussard, & More!","Main-room show featuring Jamie Wolf, Emil Wakim and Matthew Broussard. A main-room lineup of established and up-and-coming comedians.",$30.00,2026-04-08,9:00 PM,"116 E 16th St, New York, NY 10003, USA",https://thestandnyc.com/shows/
The Stand,"The Stand Presents: Emil Wakim, Mary Santora, Blake Freeman, & More!","Upstairs late show featuring Emil Wakim, Mary Santora and Blake Freeman. A late-night upstairs comedy lineup.",$25.00,2026-04-08,10:00 PM,"116 E 16th St, New York, NY 10003, USA",https://thestandnyc.com/shows/
Comedy Shop,House Comedy,The Comedy Shop’s house showcase featuring rotating local and up-and-coming comedians. Two sets are offered on the same night with different timeslots.,$16.25,2026-03-26,8:00 PM,"167 Bleecker St, New York, NY 10012, USA",https://www.comedyshopnyc.com/store/event/thursday-house-comedy-6/
Comedy Shop,House Comedy,The Comedy Shop’s house showcase featuring rotating local and up-and-coming comedians. Late-evening set on the same night.,$16.25,2026-03-26,9:00 PM,"167 Bleecker St, New York, NY 10012, USA",https://www.comedyshopnyc.com/store/event/thursday-house-comedy-6/
Comedy Shop,Primetime Comedy,Main primetime showcase with a curated lineup of comedians. Multiple showtimes and a VIP ticket option are available.,$22.50,2026-03-27,8:00 PM,"167 Bleecker St, New York, NY 10012, USA",https://www.comedyshopnyc.com/store/event/friday-primetime-comedy-5/
Comedy Shop,Primetime Comedy,Main primetime showcase with a curated lineup of comedians. Late-night set with standard and VIP ticket options.,$22.50,2026-03-27,10:00 PM,"167 Bleecker St, New York, NY 10012, USA",https://www.comedyshopnyc.com/store/event/friday-primetime-comedy-5/
Comedy Shop,House Comedy (Saturday),Evening house showcase as part of the Saturday lineup featuring multiple rotating sets. The Saturday schedule includes several different shows across the evening.,N/A,2026-03-28,6:00 PM,"167 Bleecker St, New York, NY 10012, USA",https://www.comedyshopnyc.com/store/event/saturday-brunch-party-comedy-shows-5/
Comedy Shop,Saturday Night Laughs,A Saturday night comedy show featuring a rotating lineup of performers and guest comics. Part of the venue’s weekend showcase series.,N/A,2026-03-28,7:00 PM,"167 Bleecker St, New York, NY 10012, USA",https://www.comedyshopnyc.com/store/event/saturday-brunch-party-comedy-shows-5/
Comedy Shop,House Comedy (Saturday),House Comedy set included in the Saturday lineup; one of the ticketed evening performances. Tickets list an 8:00 PM house showtime on the event page.,$22.50,2026-03-28,8:00 PM,"167 Bleecker St, New York, NY 10012, USA",https://www.comedyshopnyc.com/store/event/saturday-brunch-party-comedy-shows-5/
Comedy Shop,House Comedy (Saturday),Additional late-evening House Comedy set as part of the Saturday schedule. Multiple late sets run back-to-back throughout the night.,N/A,2026-03-28,9:00 PM,"167 Bleecker St, New York, NY 10012, USA",https://www.comedyshopnyc.com/store/event/saturday-brunch-party-comedy-shows-5/
Comedy Shop,House Comedy (Saturday),Late Saturday house set; a ticketed late-night performance listed on the venue’s Saturday events page.,$22.50,2026-03-28,10:00 PM,"167 Bleecker St, New York, NY 10012, USA",https://www.comedyshopnyc.com/store/event/saturday-brunch-party-comedy-shows-5/
Comedy Shop,House Comedy (Saturday),Late-night house set closing out the Saturday lineup. Multiple late sets provide options for different arrival times.,N/A,2026-03-28,11:00 PM,"167 Bleecker St, New York, NY 10012, USA",https://www.comedyshopnyc.com/store/event/saturday-brunch-party-comedy-shows-5/
Comedy Shop,Produced Show,A produced Sunday show featuring a curated lineup; earlier and evening produced sets are offered. Part of the venue’s Sunday programming.,$11.25,2026-03-29,6:00 PM,"167 Bleecker St, New York, NY 10012, USA",https://www.comedyshopnyc.com/store/event/sunday-produced-shows-house-comedy-6/
Comedy Shop,Produced Show,An evening produced show with a featured lineup; a higher-priced produced set later in the evening is listed on the event page.,$16.25,2026-03-29,7:00 PM,"167 Bleecker St, New York, NY 10012, USA",https://www.comedyshopnyc.com/store/event/sunday-produced-shows-house-comedy-6/
Comedy Shop,House Comedy (Sunday),The venue’s Sunday house showcase; one set is listed as a free show on the event page followed by a paid late set. A rotating lineup of comics performs.,$0.00,2026-03-29,8:00 PM,"167 Bleecker St, New York, NY 10012, USA",https://www.comedyshopnyc.com/store/event/sunday-produced-shows-house-comedy-6/
Comedy Shop,House Comedy (Sunday),Late Sunday house set with ticketed admission; part of the venue’s regular Sunday evening slate of shows.,$11.25,2026-03-29,9:00 PM,"167 Bleecker St, New York, NY 10012, USA",https://www.comedyshopnyc.com/store/event/sunday-produced-shows-house-comedy-6/
Comedy Shop,Margarita Mondays,"Margarita Mondays: drink specials and a free comedy set to kick off the week, followed by a paid House Comedy set. Specials and showtimes are listed on the event page.",$0.00,2026-03-30,8:00 PM,"167 Bleecker St, New York, NY 10012, USA",https://www.comedyshopnyc.com/store/event/monday-margaritas-house-comedy-6/
Comedy Shop,House Comedy (Monday),Monday night House Comedy follows the Margarita Mondays free set; a paid late set is offered as part of the venue’s weekly schedule.,$11.25,2026-03-30,9:00 PM,"167 Bleecker St, New York, NY 10012, USA",https://www.comedyshopnyc.com/store/event/monday-margaritas-house-comedy-6/
Comedy Shop,New Jokes,A Tuesday show showcasing new material from local comics (listed as a free show on the event page). This is followed by the House Comedy paid set.,$0.00,2026-03-31,8:00 PM,"167 Bleecker St, New York, NY 10012, USA",https://www.comedyshopnyc.com/store/event/tuesday-new-jokes-house-comedy-8/
Comedy Shop,House Comedy (Tuesday),Tuesday night House Comedy; a paid late set following the New Jokes open-stage-style show. Rotating lineup of performers.,$11.25,2026-03-31,9:00 PM,"167 Bleecker St, New York, NY 10012, USA",https://www.comedyshopnyc.com/store/event/tuesday-new-jokes-house-comedy-8/
The Comic Strip,"Tobin Miller (NYCF’s Comic to Watch), Meghan Hanley (Dry Bar Comedy), Sean Donnelly (The Tonight Show), JJ Ramirez (Latin Legends of Comedy), Chuck Nice (StarTalk), & Gregg Rogell (The Tonight Show)!","Stand-up comedy showcase featuring a rotating lineup of established and rising comedians including Tobin Miller, Meghan Hanley, Sean Donnelly, JJ Ramirez, Chuck Nice, and Gregg Rogell.",N/A,2026-03-27,8:00 PM,"1568 2nd Ave, New York, NY 10028, USA",https://comicstriplive.com/schedule/
The Comic Strip,"Tobin Miller (NYCF’s Comic to Watch), Meghan Hanley (Dry Bar Comedy), Sean Donnelly (The Tonight Show), JJ Ramirez (Latin Legends of Comedy), Chuck Nice (StarTalk), & Gregg Rogell (The Tonight Show)!",Late-night stand-up show featuring the same lineup of comedians performing extended or late sets.,N/A,2026-03-27,10:30 PM,"1568 2nd Ave, New York, NY 10028, USA",https://comicstriplive.com/schedule/
The Comic Strip,"Tom Van Horn (Last Comic Standing), Wali Collins (Coyote Ugly), Connor O’Brien (Don’t Tell Comedy), Chuck Nice (StarTalk), & JJ Ramirez (Latin Legends of Comedy)!","Stand-up comedy show featuring Tom Van Horn alongside guest comedians Wali Collins, Connor O’Brien, Chuck Nice, and JJ Ramirez.",N/A,2026-03-28,8:00 PM,"1568 2nd Ave, New York, NY 10028, USA",https://comicstriplive.com/schedule/
The Comic Strip,"Tom Van Horn (Last Comic Standing), Wali Collins (Coyote Ugly), Connor O’Brien (Don’t Tell Comedy), Chuck Nice (StarTalk), & JJ Ramirez (Latin Legends of Comedy)!",Late-night edition of the Tom Van Horn showcase with the same lineup offering additional sets.,N/A,2026-03-28,10:30 PM,"1568 2nd Ave, New York, NY 10028, USA",https://comicstriplive.com/schedule/
The Comic Strip,"Sheba Mason (CBS), Caroline Hanes (Love Island USA), Howard Feller (Letterman), Jason Choi (Don’t Tell Comedy), & Brian Scott McFadden (Ice Age: The Meltdown)!","An evening stand-up showcase featuring Sheba Mason, Caroline Hanes, Howard Feller, Jason Choi, and Brian Scott McFadden.",N/A,2026-03-29,8:00 PM,"1568 2nd Ave, New York, NY 10028, USA",https://comicstriplive.com/schedule/
The Comic Strip,Monday Night Laughs with Al Lubel (David Letterman)!,Weekly Monday night comedy show headlined by Al Lubel with a lineup of guest comics.,N/A,2026-03-30,8:00 PM,"1568 2nd Ave, New York, NY 10028, USA",https://comicstriplive.com/schedule/
The Comic Strip,"DF Sweedler (New York Times), Nick Tilleli (New York Comedy Festival), Subhah Agarwal (Westworld), Richie Redding (Gotham Comedy Live!), Christian Finnegan (Chapelle’s Show), & Michael Harrison (NBC)!","Stand-up showcase featuring a diverse lineup of comedians including DF Sweedler, Nick Tilleli, Subhah Agarwal, Richie Redding, Christian Finnegan, and Michael Harrison.",N/A,2026-03-31,8:00 PM,"1568 2nd Ave, New York, NY 10028, USA",https://comicstriplive.com/schedule/
The Comic Strip,"Barry Weintraub (Comedy Central), Rachel Lenihan (Hulu), Jason Choi (Don’t Tell Comedy), Nick Tilleli (New York Comedy Festival), Paul Mecurio (The Daily Show with Jon Stewart), & JJ Ramirez (Latin Legend of Comedy)!","Evening stand-up event featuring Barry Weintraub, Rachel Lenihan, Jason Choi, Nick Tilleli, Paul Mecurio, and JJ Ramirez.",N/A,2026-04-01,8:00 PM,"1568 2nd Ave, New York, NY 10028, USA",https://comicstriplive.com/schedule/
The Comic Strip,Hard Knocks Laughs!,Themed comedy night (Hard Knocks Laughs) featuring a rotating slate of stand-up performers.,N/A,2026-04-02,8:00 PM,"1568 2nd Ave, New York, NY 10028, USA",https://comicstriplive.com/schedule/
The Comic Strip,"Ken Boyd (Showtime at The Apollo), Caroline Hanes (Peacock), Connor O’Brien (Don’t Tell Comedy), Mike Yard (The Nightly Show), & JJ Ramirez (Latin Legend of Comedy)!","Friday evening comedy showcase headlined by Ken Boyd with guest performers Caroline Hanes, Connor O’Brien, Mike Yard, and JJ Ramirez.",N/A,2026-04-03,8:00 PM,"1568 2nd Ave, New York, NY 10028, USA",https://comicstriplive.com/schedule/
The Comic Strip,Friday Night Easter Weekend Show with Ruperto Vanderpool! / DJ EM Show with Ken Boyd!,Late-night Easter weekend shows featuring Ruperto Vanderpool and a DJ EM show with Ken Boyd — a mix of stand-up and DJ-hosted entertainment.,N/A,2026-04-03,10:30 PM,"1568 2nd Ave, New York, NY 10028, USA",https://comicstriplive.com/schedule/
The Comic Strip,"Tom Van Horn (Comedy Central), Connor O’Brien (Don’t Tell Comedy), Jason Choi (Don’t Tell Comedy), Mike Yard (The Nightly Show), & JJ Ramirez (Latin Legend of Comedy)!",Saturday night stand-up show led by Tom Van Horn with a rotating roster of guest comedians.,N/A,2026-04-04,8:00 PM,"1568 2nd Ave, New York, NY 10028, USA",https://comicstriplive.com/schedule/
The Comic Strip,"Tom Van Horn (Comedy Central), Connor O’Brien (Don’t Tell Comedy), Jason Choi (Don’t Tell Comedy), Mike Yard (The Nightly Show), & JJ Ramirez (Latin Legend of Comedy)!",Late-night edition of the Tom Van Horn showcase featuring additional sets from the same lineup.,N/A,2026-04-04,10:30 PM,"1568 2nd Ave, New York, NY 10028, USA",https://comicstriplive.com/schedule/
The Comic Strip,"DF Sweedler (New York Times), Al Lubel (Letterman), Rachel Lenihan (Hulu), Mike Yard (The Nightly Show), Harrison Greenbaum (America's Got Talent) & Kareem Green (Showtime)!","Sunday evening comedy showcase with a lineup of noted comics including DF Sweedler, Al Lubel, Rachel Lenihan, Mike Yard, Harrison Greenbaum, and Kareem Green.",N/A,2026-04-05,8:00 PM,"1568 2nd Ave, New York, NY 10028, USA",https://comicstriplive.com/schedule/
The Comic Strip,Peter Stewart Show with Jason Salmon (30 Rock)!,Monday night showcase hosted by Peter Stewart with guest Jason Salmon and additional comics.,N/A,2026-04-06,8:00 PM,"1568 2nd Ave, New York, NY 10028, USA",https://comicstriplive.com/schedule/
The Comic Strip,"Tom Van Horn (Comedy Central), Al Lubel (Letterman), Caroline Hanes (Peacock), Paul Mecurio (The Daily Show with Jon Stewart), & Christian Finnegan (Chappelle Show)!","Tuesday evening stand-up event featuring Tom Van Horn and guest headliners including Al Lubel, Caroline Hanes, Paul Mecurio, and Christian Finnegan.",N/A,2026-04-07,8:00 PM,"1568 2nd Ave, New York, NY 10028, USA",https://comicstriplive.com/schedule/
The Comic Strip,"Barry Weintraub (Comedy Central), Michele Balan (NBC), Jason Choi (Don’t Tell Comedy), Dan Naturman (America's Got Talent), Christian Finnegan (Chappelle Show), Kareem Green (Showtime)!","Wednesday night comedy showcase featuring Barry Weintraub, Michele Balan, Jason Choi, Dan Naturman, Christian Finnegan, and Kareem Green.",N/A,2026-04-08,8:00 PM,"1568 2nd Ave, New York, NY 10028, USA",https://comicstriplive.com/schedule/
The Comic Strip,"Jim Mendrinos (Comedy Central), Sean Donnelly (The Tonight Show), Caroline Hanes (Peacock), Dan Naturman (America's Got Talent), Connor O’Brien (Don’t Tell Comedy), Chris Roach (Kevin Can Wait) & JJ Ramirez (Latin Legend of Comedy)","Thursday night stand-up show featuring Jim Mendrinos, Sean Donnelly, Caroline Hanes, Dan Naturman, Connor O’Brien, Chris Roach, and JJ Ramirez.",N/A,2026-04-09,8:00 PM,"1568 2nd Ave, New York, NY 10028, USA",https://comicstriplive.com/schedule/
Fat Black Pussycat,Stand-up Comedy Show (Lounge),"Stand-up comedy show presented by the Comedy Cellar at the Fat Black Pussycat, featuring rotating lineups of established and up-and-coming comedians. Two-item minimum; 21+.",$18.00,2026-03-26,7:00 PM,"130 W 3rd St, New York, NY 10012, USA",https://www.comedycellar.com/reservations-newyork/
Fat Black Pussycat,Stand-up Comedy Show (Bar),"Stand-up comedy show presented by the Comedy Cellar at the Fat Black Pussycat, featuring rotating lineups of established and up-and-coming comedians. Two-item minimum; 21+.",$18.00,2026-03-26,8:30 PM,"130 W 3rd St, New York, NY 10012, USA",https://www.comedycellar.com/reservations-newyork/
Fat Black Pussycat,Stand-up Comedy Show (Lounge),"Stand-up comedy show presented by the Comedy Cellar at the Fat Black Pussycat, featuring rotating lineups of established and up-and-coming comedians. Two-item minimum; 21+.",$18.00,2026-03-26,9:00 PM,"130 W 3rd St, New York, NY 10012, USA",https://www.comedycellar.com/reservations-newyork/
Fat Black Pussycat,Stand-up Comedy Show (Bar),"Stand-up comedy show presented by the Comedy Cellar at the Fat Black Pussycat, featuring rotating lineups of established and up-and-coming comedians. Two-item minimum; 21+.",$18.00,2026-03-26,10:30 PM,"130 W 3rd St, New York, NY 10012, USA",https://www.comedycellar.com/reservations-newyork/
Fat Black Pussycat,Stand-up Comedy Show (Lounge),"Stand-up comedy show presented by the Comedy Cellar at the Fat Black Pussycat, featuring rotating lineups of established and up-and-coming comedians. Two-item minimum; 21+.",$18.00,2026-03-26,11:00 PM,"130 W 3rd St, New York, NY 10012, USA",https://www.comedycellar.com/reservations-newyork/
Fat Black Pussycat,Stand-up Comedy Show,"Stand-up comedy show presented by the Comedy Cellar at the Fat Black Pussycat, featuring rotating lineups of established and up-and-coming comedians. Two-item minimum; 21+.",$25.00,2026-03-27,7:00 PM,"130 W 3rd St, New York, NY 10012, USA",https://www.comedycellar.com/reservations-newyork/
Fat Black Pussycat,Stand-up Comedy Show,"Stand-up comedy show presented by the Comedy Cellar at the Fat Black Pussycat, featuring rotating lineups of established and up-and-coming comedians. Two-item minimum; 21+.",$25.00,2026-03-27,7:30 PM,"130 W 3rd St, New York, NY 10012, USA",https://www.comedycellar.com/reservations-newyork/
Fat Black Pussycat,Stand-up Comedy Show,"Stand-up comedy show presented by the Comedy Cellar at the Fat Black Pussycat, featuring rotating lineups of established and up-and-coming comedians. Two-item minimum; 21+.",$25.00,2026-03-27,9:00 PM,"130 W 3rd St, New York, NY 10012, USA",https://www.comedycellar.com/reservations-newyork/
Fat Black Pussycat,Stand-up Comedy Show,"Stand-up comedy show presented by the Comedy Cellar at the Fat Black Pussycat, featuring rotating lineups of established and up-and-coming comedians. Two-item minimum; 21+.",$25.00,2026-03-27,9:30 PM,"130 W 3rd St, New York, NY 10012, USA",https://www.comedycellar.com/reservations-newyork/
Fat Black Pussycat,Stand-up Comedy Show,"Stand-up comedy show presented by the Comedy Cellar at the Fat Black Pussycat, featuring rotating lineups of established and up-and-coming comedians. Two-item minimum; 21+.",$25.00,2026-03-28,7:00 PM,"130 W 3rd St, New York, NY 10012, USA",https://www.comedycellar.com/reservations-newyork/
Fat Black Pussycat,Stand-up Comedy Show,"Stand-up comedy show presented by the Comedy Cellar at the Fat Black Pussycat, featuring rotating lineups of established and up-and-coming comedians. Two-item minimum; 21+.",$25.00,2026-03-28,7:30 PM,"130 W 3rd St, New York, NY 10012, USA",https://www.comedycellar.com/reservations-newyork/
Fat Black Pussycat,Stand-up Comedy Show,"Stand-up comedy show presented by the Comedy Cellar at the Fat Black Pussycat, featuring rotating lineups of established and up-and-coming comedians. Two-item minimum; 21+.",$25.00,2026-03-28,9:00 PM,"130 W 3rd St, New York, NY 10012, USA",https://www.comedycellar.com/reservations-newyork/
Fat Black Pussycat,Stand-up Comedy Show,"Stand-up comedy show presented by the Comedy Cellar at the Fat Black Pussycat, featuring rotating lineups of established and up-and-coming comedians. Two-item minimum; 21+.",$25.00,2026-03-28,9:30 PM,"130 W 3rd St, New York, NY 10012, USA",https://www.comedycellar.com/reservations-newyork/
Fat Black Pussycat,Stand-up Comedy Show (Lounge),"Stand-up comedy show presented by the Comedy Cellar at the Fat Black Pussycat, featuring rotating lineups of established and up-and-coming comedians. Two-item minimum; 21+.",$18.00,2026-03-29,7:00 PM,"130 W 3rd St, New York, NY 10012, USA",https://www.comedycellar.com/reservations-newyork/
Fat Black Pussycat,Stand-up Comedy Show (Bar),"Stand-up comedy show presented by the Comedy Cellar at the Fat Black Pussycat, featuring rotating lineups of established and up-and-coming comedians. Two-item minimum; 21+.",$18.00,2026-03-29,8:30 PM,"130 W 3rd St, New York, NY 10012, USA",https://www.comedycellar.com/reservations-newyork/
Fat Black Pussycat,Stand-up Comedy Show (Lounge),"Stand-up comedy show presented by the Comedy Cellar at the Fat Black Pussycat, featuring rotating lineups of established and up-and-coming comedians. Two-item minimum; 21+.",$18.00,2026-03-29,9:00 PM,"130 W 3rd St, New York, NY 10012, USA",https://www.comedycellar.com/reservations-newyork/
Fat Black Pussycat,Stand-up Comedy Show (Bar),"Stand-up comedy show presented by the Comedy Cellar at the Fat Black Pussycat, featuring rotating lineups of established and up-and-coming comedians. Two-item minimum; 21+.",$18.00,2026-03-29,10:30 PM,"130 W 3rd St, New York, NY 10012, USA",https://www.comedycellar.com/reservations-newyork/
Fat Black Pussycat,Stand-up Comedy Show (Bar),"Stand-up comedy show presented by the Comedy Cellar at the Fat Black Pussycat, featuring rotating lineups of established and up-and-coming comedians. Two-item minimum; 21+.",$15.00,2026-03-30,7:35 PM,"130 W 3rd St, New York, NY 10012, USA",https://www.comedycellar.com/reservations-newyork/
Fat Black Pussycat,New Joke Night (Lounge),New Joke Night — a Comedy Cellar Monday night show featuring new material from a rotating lineup of comedians. Two-item minimum; 21+. (Listed as Monday New Joke Night on the venue schedule.),$10.00,2026-03-30,8:30 PM,"130 W 3rd St, New York, NY 10012, USA",https://www.comedycellar.com/reservations-newyork/
Fat Black Pussycat,Stand-up Comedy Show (Bar),"Stand-up comedy show presented by the Comedy Cellar at the Fat Black Pussycat, featuring rotating lineups of established and up-and-coming comedians. Two-item minimum; 21+.",$15.00,2026-03-30,9:35 PM,"130 W 3rd St, New York, NY 10012, USA",https://www.comedycellar.com/reservations-newyork/
Fat Black Pussycat,Stand-up Comedy Show (Lounge),"Stand-up comedy show presented by the Comedy Cellar at the Fat Black Pussycat, featuring rotating lineups of established and up-and-coming comedians. Two-item minimum; 21+.",$15.00,2026-03-31,7:35 PM,"130 W 3rd St, New York, NY 10012, USA",https://www.comedycellar.com/reservations-newyork/
Fat Black Pussycat,Stand-up Comedy Show (Lounge),Hot Soup Comedy — late-night Tuesday show featuring a rotating lineup of comedians (listed on Comedy Cellar site). Two-item minimum; 21+.,$20.00,2026-03-31,10:30 PM,"130 W 3rd St, New York, NY 10012, USA",https://www.comedycellar.com/reservations-newyork/
Fat Black Pussycat,Stand-up Comedy Show (Lounge),"Stand-up comedy show presented by the Comedy Cellar at the Fat Black Pussycat, featuring rotating lineups of established and up-and-coming comedians. Two-item minimum; 21+.",$15.00,2026-03-31,8:30 PM,"130 W 3rd St, New York, NY 10012, USA",https://www.comedycellar.com/reservations-newyork/
Fat Black Pussycat,Stand-up Comedy Show (Bar),"Stand-up comedy show presented by the Comedy Cellar at the Fat Black Pussycat, featuring rotating lineups of established and up-and-coming comedians. Two-item minimum; 21+.",$15.00,2026-04-01,7:35 PM,"130 W 3rd St, New York, NY 10012, USA",https://www.comedycellar.com/reservations-newyork/
Fat Black Pussycat,Stand-up Comedy Show (Lounge),"Stand-up comedy show presented by the Comedy Cellar at the Fat Black Pussycat, featuring rotating lineups of established and up-and-coming comedians. Two-item minimum; 21+.",$15.00,2026-04-01,8:30 PM,"130 W 3rd St, New York, NY 10012, USA",https://www.comedycellar.com/reservations-newyork/
Fat Black Pussycat,Stand-up Comedy Show (Bar),"Stand-up comedy show presented by the Comedy Cellar at the Fat Black Pussycat, featuring rotating lineups of established and up-and-coming comedians. Two-item minimum; 21+.",$15.00,2026-04-01,9:35 PM,"130 W 3rd St, New York, NY 10012, USA",https://www.comedycellar.com/reservations-newyork/
Fat Black Pussycat,Stand-up Comedy Show (Lounge),"Stand-up comedy show presented by the Comedy Cellar at the Fat Black Pussycat, featuring rotating lineups of established and up-and-coming comedians. Two-item minimum; 21+.",$18.00,2026-04-02,7:00 PM,"130 W 3rd St, New York, NY 10012, USA",https://www.comedycellar.com/reservations-newyork/
Fat Black Pussycat,Stand-up Comedy Show (Bar),"Stand-up comedy show presented by the Comedy Cellar at the Fat Black Pussycat, featuring rotating lineups of established and up-and-coming comedians. Two-item minimum; 21+.",$18.00,2026-04-02,8:30 PM,"130 W 3rd St, New York, NY 10012, USA",https://www.comedycellar.com/reservations-newyork/
Fat Black Pussycat,Stand-up Comedy Show (Lounge),"Stand-up comedy show presented by the Comedy Cellar at the Fat Black Pussycat, featuring rotating lineups of established and up-and-coming comedians. Two-item minimum; 21+.",$18.00,2026-04-02,9:00 PM,"130 W 3rd St, New York, NY 10012, USA",https://www.comedycellar.com/reservations-newyork/
Fat Black Pussycat,Stand-up Comedy Show (Bar),"Stand-up comedy show presented by the Comedy Cellar at the Fat Black Pussycat, featuring rotating lineups of established and up-and-coming comedians. Two-item minimum; 21+.",$18.00,2026-04-02,10:30 PM,"130 W 3rd St, New York, NY 10012, USA",https://www.comedycellar.com/reservations-newyork/
Fat Black Pussycat,Stand-up Comedy Show (Lounge),"Stand-up comedy show presented by the Comedy Cellar at the Fat Black Pussycat, featuring rotating lineups of established and up-and-coming comedians. Two-item minimum; 21+.",$18.00,2026-04-02,11:00 PM,"130 W 3rd St, New York, NY 10012, USA",https://www.comedycellar.com/reservations-newyork/
